{
  "kind": "promotion_capsule.v1",
  "integration_id": "workbench-prompt-registry-001.iteration-0001",
  "base_main_commit": "25d159c89ca099bca1623988b0f60f6127c60295",
  "contract_commit": "5ebb0404051985e9a1e25cd0c87ac2783cc92b51",
  "bounded_batch_id": "workbench-prompt-registry-operationalization-001",
  "patch_hash": "workbench-prompt-registry-001-plan-review-001",
  "validation_ref_mode": "bundle_relative",
  "validation_refs": [
    "evidence/plan-packet-validate.check.json",
    "evidence/review-manifest-validate.check.json",
    "evidence/review-bundle-status.check.json",
    "evidence/loop-state-schema-validate.check.json",
    "evidence/promotion-capsule-schema-validate.check.json"
  ],
  "status": "PENDING"
}
